{
  "$schema": "https://json-schema.org/draft/2020-12/schema",
  "$id": "https://github.com/PlasmaStorm49/musicle-jp/shared/schema/catalog.schema.json",
  "title": "Catálogo do musicle-jp",
  "description": "Contrato entre o pipeline (Python) e o jogo (TypeScript). Gerado só pelo pipeline.",
  "type": "object",
  "additionalProperties": false,
  "required": [
    "schemaVersion",
    "catalogVersion",
    "generatedAt",
    "provider",
    "storefront",
    "snapshots",
    "artists",
    "albums",
    "tracks"
  ],
  "properties": {
    "schemaVersion": { "const": 2 },
    "catalogVersion": { "type": "string", "pattern": "^\\d{4}-\\d{2}-\\d{2}\\.[0-9a-f]{8}$" },
    "generatedAt": { "$ref": "#/$defs/timestamp" },
    "provider": { "type": "string", "pattern": "^[a-z]+$" },
    "storefront": { "type": "string", "pattern": "^[a-z]{2}$" },
    "snapshots": { "type": "array", "minItems": 1, "items": { "$ref": "#/$defs/snapshot" } },
    "artists": { "type": "array", "minItems": 1, "items": { "$ref": "#/$defs/artist" } },
    "albums": { "type": "array", "minItems": 1, "items": { "$ref": "#/$defs/album" } },
    "tracks": { "type": "array", "minItems": 1, "items": { "$ref": "#/$defs/track" } }
  },
  "$defs": {
    "date": { "type": "string", "pattern": "^\\d{4}-\\d{2}-\\d{2}$" },
    "timestamp": { "type": "string", "pattern": "^\\d{4}-\\d{2}-\\d{2}T\\d{2}:\\d{2}:\\d{2}Z$" },
    "text": { "type": "string", "minLength": 1 },
    "optionalText": { "type": ["string", "null"], "minLength": 1 },
    "url": { "type": "string", "pattern": "^[^\\s\\\\]+$" },
    "rank": { "type": "integer", "minimum": 1 },
    "latinSource": { "enum": ["provider", "manual", "cutlet", null] },
    "artistId": { "type": "string", "pattern": "^[a-z]+:ar:[A-Za-z0-9_-]+$" },
    "albumId": { "type": "string", "pattern": "^[a-z]+:al:[A-Za-z0-9_-]+$" },
    "trackId": { "type": "string", "pattern": "^[a-z]+:tr:[A-Za-z0-9_-]+$" },
    "artistIds": {
      "type": "array",
      "minItems": 1,
      "uniqueItems": true,
      "items": { "$ref": "#/$defs/artistId" }
    },
    "searchKeys": { "type": "array", "uniqueItems": true, "items": { "$ref": "#/$defs/text" } },
    "snapshot": {
      "type": "object",
      "additionalProperties": false,
      "required": ["id", "date", "fetchedAt", "chart", "size"],
      "properties": {
        "id": { "$ref": "#/$defs/text" },
        "date": { "$ref": "#/$defs/date" },
        "fetchedAt": { "$ref": "#/$defs/timestamp" },
        "chart": { "$ref": "#/$defs/text" },
        "size": { "type": "integer", "minimum": 1 }
      }
    },
    "artist": {
      "type": "object",
      "additionalProperties": false,
      "required": ["id", "name", "nameLatin", "latinSource"],
      "properties": {
        "id": { "$ref": "#/$defs/artistId" },
        "name": { "$ref": "#/$defs/text" },
        "nameLatin": { "$ref": "#/$defs/optionalText" },
        "latinSource": { "$ref": "#/$defs/latinSource" }
      }
    },
    "album": {
      "type": "object",
      "additionalProperties": false,
      "required": [
        "id",
        "title",
        "titleLatin",
        "latinSource",
        "artistIds",
        "artistDisplay",
        "type",
        "releaseDate",
        "artworkUrl",
        "similar"
      ],
      "properties": {
        "id": { "$ref": "#/$defs/albumId" },
        "title": { "$ref": "#/$defs/text" },
        "titleLatin": { "$ref": "#/$defs/optionalText" },
        "latinSource": { "$ref": "#/$defs/latinSource" },
        "artistIds": { "$ref": "#/$defs/artistIds" },
        "artistDisplay": { "$ref": "#/$defs/text" },
        "type": { "enum": ["single", "album", "ep", "compilation"] },
        "releaseDate": { "$ref": "#/$defs/date" },
        "artworkUrl": { "oneOf": [{ "$ref": "#/$defs/url" }, { "type": "null" }] },
        "similar": {
          "description": "Distratores do Normal (4 opções de álbum).",
          "type": "array",
          "maxItems": 10,
          "uniqueItems": true,
          "items": { "$ref": "#/$defs/albumId" }
        }
      }
    },
    "preview": {
      "type": "object",
      "additionalProperties": false,
      "required": ["url", "durationSec", "startSec"],
      "properties": {
        "url": { "$ref": "#/$defs/url" },
        "durationSec": { "type": ["number", "null"], "exclusiveMinimum": 0 },
        "startSec": { "type": "number", "minimum": 0 }
      }
    },
    "chart": {
      "type": "object",
      "additionalProperties": false,
      "required": ["firstSeen", "lastSeen", "bestRank", "lastRank", "appearances", "inLatest"],
      "properties": {
        "firstSeen": { "$ref": "#/$defs/date" },
        "lastSeen": { "$ref": "#/$defs/date" },
        "bestRank": { "$ref": "#/$defs/rank" },
        "lastRank": { "$ref": "#/$defs/rank" },
        "appearances": { "type": "integer", "minimum": 1 },
        "inLatest": { "type": "boolean" }
      }
    },
    "eligible": {
      "oneOf": [
        {
          "type": "object",
          "additionalProperties": false,
          "required": ["daily", "reason"],
          "properties": { "daily": { "const": true }, "reason": { "const": null } }
        },
        {
          "type": "object",
          "additionalProperties": false,
          "required": ["daily", "reason"],
          "properties": {
            "daily": { "const": false },
            "reason": { "enum": ["no-preview", "short-preview", "no-artwork", "explicit", "blocked"] }
          }
        }
      ]
    },
    "track": {
      "type": "object",
      "additionalProperties": false,
      "required": [
        "id",
        "songKey",
        "title",
        "titleLatin",
        "latinSource",
        "artistIds",
        "artistDisplay",
        "albumId",
        "releaseDate",
        "durationMs",
        "explicit",
        "isrc",
        "preview",
        "storeUrl",
        "chart",
        "popularity",
        "eligible",
        "search"
      ],
      "properties": {
        "id": { "$ref": "#/$defs/trackId" },
        "songKey": { "type": "string", "pattern": "^.+\\|[a-z]+:ar:[A-Za-z0-9_-]+$" },
        "title": { "$ref": "#/$defs/text" },
        "titleLatin": { "$ref": "#/$defs/optionalText" },
        "latinSource": { "$ref": "#/$defs/latinSource" },
        "artistIds": { "$ref": "#/$defs/artistIds" },
        "artistDisplay": { "$ref": "#/$defs/text" },
        "albumId": { "$ref": "#/$defs/albumId" },
        "releaseDate": { "$ref": "#/$defs/date" },
        "durationMs": { "type": "integer", "minimum": 1 },
        "explicit": { "type": "boolean" },
        "isrc": {
          "oneOf": [{ "type": "string", "pattern": "^[A-Z]{2}[A-Z0-9]{3}[0-9]{7}$" }, { "type": "null" }]
        },
        "preview": { "oneOf": [{ "$ref": "#/$defs/preview" }, { "type": "null" }] },
        "storeUrl": {
          "description": "Página da faixa na loja (link \"Ouvir no Apple Music\" da revelação); null sem loja.",
          "oneOf": [{ "$ref": "#/$defs/url" }, { "type": "null" }]
        },
        "chart": { "$ref": "#/$defs/chart" },
        "popularity": { "type": "number", "minimum": 0, "maximum": 1 },
        "eligible": { "$ref": "#/$defs/eligible" },
        "search": {
          "description": "Chaves da busca do Desafio (digitação).",
          "type": "object",
          "additionalProperties": false,
          "required": ["title", "artist"],
          "properties": {
            "title": { "$ref": "#/$defs/searchKeys" },
            "artist": { "$ref": "#/$defs/searchKeys" }
          }
        }
      }
    }
  }
}
