{
  "albums": [
    {
      "artistDisplay": "ミナト",
      "artistIds": [
        "fixture:ar:ar01"
      ],
      "artworkUrl": "fixtures/art/al01.svg",
      "id": "fixture:al:al01",
      "latinSource": "cutlet",
      "releaseDate": "2024-03-01",
      "similar": [
        "fixture:al:al05",
        "fixture:al:al09",
        "fixture:al:al32",
        "fixture:al:al07",
        "fixture:al:al18",
        "fixture:al:al16",
        "fixture:al:al15",
        "fixture:al:al08",
        "fixture:al:al10",
        "fixture:al:al20"
      ],
      "title": "夜明けのメロディ - Single",
      "titleLatin": "Yoake no merodi",
      "type": "single"
    },
    {
      "artistDisplay": "ミナト",
      "artistIds": [
        "fixture:ar:ar01"
      ],
      "artworkUrl": "fixtures/art/al02.svg",
      "id": "fixture:al:al02",
      "latinSource": null,
      "releaseDate": "2024-11-20",
      "similar": [
        "fixture:al:al18",
        "fixture:al:al16",
        "fixture:al:al32",
        "fixture:al:al14",
        "fixture:al:al09",
        "fixture:al:al15",
        "fixture:al:al08",
        "fixture:al:al10",
        "fixture:al:al07",
        "fixture:al:al20"
      ],
      "title": "Dawn Collection",
      "titleLatin": null,
      "type": "album"
    },
    {
      "artistDisplay": "ミナト",
      "artistIds": [
        "fixture:ar:ar01"
      ],
      "artworkUrl": "fixtures/art/al03.svg",
      "id": "fixture:al:al03",
      "latinSource": "cutlet",
      "releaseDate": "2024-04-10",
      "similar": [
        "fixture:al:al33",
        "fixture:al:al28",
        "fixture:al:al20",
        "fixture:al:al27",
        "fixture:al:al04",
        "fixture:al:al21",
        "fixture:al:al08",
        "fixture:al:al22",
        "fixture:al:al24",
        "fixture:al:al15"
      ],
      "title": "夜明けのメロディ (TV Size) - Single",
      "titleLatin": "Yoake no merodi (TV Size)",
      "type": "single"
    },
    {
      "artistDisplay": "ナナ",
      "artistIds": [
        "fixture:ar:ar14"
      ],
      "artworkUrl": "fixtures/art/al04.svg",
      "id": "fixture:al:al04",
      "latinSource": "cutlet",
      "releaseDate": "2023-06-14",
      "similar": [
        "fixture:al:al10",
        "fixture:al:al20",
        "fixture:al:al03",
        "fixture:al:al15",
        "fixture:al:al06",
        "fixture:al:al21",
        "fixture:al:al22",
        "fixture:al:al17",
        "fixture:al:al13",
        "fixture:al:al29"
      ],
      "title": "七色ノート",
      "titleLatin": "Nanairo nooto",
      "type": "album"
    },
    {
      "artistDisplay": "夜風シアター & 青井ユウ",
      "artistIds": [
        "fixture:ar:ar02",
        "fixture:ar:ar07"
      ],
      "artworkUrl": "fixtures/art/al05.svg",
      "id": "fixture:al:al05",
      "latinSource": "cutlet",
      "releaseDate": "2025-02-14",
      "similar": [
        "fixture:al:al01",
        "fixture:al:al26",
        "fixture:al:al07",
        "fixture:al:al32",
        "fixture:al:al18",
        "fixture:al:al16",
        "fixture:al:al15",
        "fixture:al:al08",
        "fixture:al:al10",
        "fixture:al:al20"
      ],
      "title": "ふたりの約束 - Single",
      "titleLatin": "Futari no yakusoku",
      "type": "single"
    },
    {
      "artistDisplay": "月見坂46",
      "artistIds": [
        "fixture:ar:ar10"
      ],
      "artworkUrl": "fixtures/art/al06.svg",
      "id": "fixture:al:al06",
      "latinSource": "cutlet",
      "releaseDate": "2025-08-27",
      "similar": [
        "fixture:al:al14",
        "fixture:al:al16",
        "fixture:al:al15",
        "fixture:al:al02",
        "fixture:al:al08",
        "fixture:al:al32",
        "fixture:al:al10",
        "fixture:al:al09",
        "fixture:al:al20",
        "fixture:al:al33"
      ],
      "title": "坂道の向こう - Single",
      "titleLatin": "Sakamichi no mukou",
      "type": "single"
    },
    {
      "artistDisplay": "ヴィオラ・ノート",
      "artistIds": [
        "fixture:ar:ar09"
      ],
      "artworkUrl": "fixtures/art/al07.svg",
      "id": "fixture:al:al07",
      "latinSource": "cutlet",
      "releaseDate": "2026-09-30",
      "similar": [
        "fixture:al:al26",
        "fixture:al:al05",
        "fixture:al:al01",
        "fixture:al:al32",
        "fixture:al:al18",
        "fixture:al:al16",
        "fixture:al:al08",
        "fixture:al:al10",
        "fixture:al:al20",
        "fixture:al:al33"
      ],
      "title": "秋風のワルツ - Single",
      "titleLatin": "Akikaze no warutsu",
      "type": "single"
    },
    {
      "artistDisplay": "さくらんぼ組",
      "artistIds": [
        "fixture:ar:ar04"
      ],
      "artworkUrl": "fixtures/art/al08.svg",
      "id": "fixture:al:al08",
      "latinSource": "cutlet",
      "releaseDate": "2026-07-20",
      "similar": [
        "fixture:al:al10",
        "fixture:al:al20",
        "fixture:al:al14",
        "fixture:al:al33",
        "fixture:al:al06",
        "fixture:al:al16",
        "fixture:al:al03",
        "fixture:al:al32",
        "fixture:al:al21",
        "fixture:al:al09"
      ],
      "title": "なつやすみ - Single",
      "titleLatin": "Natsuyasumi",
      "type": "single"
    },
    {
      "artistDisplay": "KOTONOHA",
      "artistIds": [
        "fixture:ar:ar08"
      ],
      "artworkUrl": "fixtures/art/al09-v2.svg",
      "id": "fixture:al:al09",
      "latinSource": "cutlet",
      "releaseDate": "2026-05-13",
      "similar": [
        "fixture:al:al01",
        "fixture:al:al32",
        "fixture:al:al05",
        "fixture:al:al18",
        "fixture:al:al07",
        "fixture:al:al16",
        "fixture:al:al08",
        "fixture:al:al10",
        "fixture:al:al20",
        "fixture:al:al33"
      ],
      "title": "透明なシグナル - Single",
      "titleLatin": "Toumei na shigunaru",
      "type": "single"
    },
    {
      "artistDisplay": "Re:Pulse",
      "artistIds": [
        "fixture:ar:ar11"
      ],
      "artworkUrl": "fixtures/art/al10.svg",
      "id": "fixture:al:al10",
      "latinSource": null,
      "releaseDate": "2025-10-10",
      "similar": [
        "fixture:al:al04",
        "fixture:al:al20",
        "fixture:al:al08",
        "fixture:al:al33",
        "fixture:al:al15",
        "fixture:al:al03",
        "fixture:al:al14",
        "fixture:al:al06",
        "fixture:al:al16",
        "fixture:al:al21"
      ],
      "title": "RIOT",
      "titleLatin": null,
      "type": "ep"
    },
    {
      "artistDisplay": "ぱぴぷ楽団",
      "artistIds": [
        "fixture:ar:ar12"
      ],
      "artworkUrl": "fixtures/art/al11.svg",
      "id": "fixture:al:al11",
      "latinSource": "cutlet",
      "releaseDate": "2026-04-01",
      "similar": [
        "fixture:al:al23",
        "fixture:al:al17",
        "fixture:al:al30",
        "fixture:al:al24",
        "fixture:al:al22",
        "fixture:al:al27",
        "fixture:al:al28",
        "fixture:al:al03",
        "fixture:al:al33",
        "fixture:al:al14"
      ],
      "title": "ぽんぽこマーチ - Single",
      "titleLatin": "Pon poko maachi",
      "type": "single"
    },
    {
      "artistDisplay": "Hoshizora Drive",
      "artistIds": [
        "fixture:ar:ar06"
      ],
      "artworkUrl": null,
      "id": "fixture:al:al12",
      "latinSource": null,
      "releaseDate": "2022-09-09",
      "similar": [
        "fixture:al:al02",
        "fixture:al:al15",
        "fixture:al:al04",
        "fixture:al:al20",
        "fixture:al:al13",
        "fixture:al:al29",
        "fixture:al:al16",
        "fixture:al:al18",
        "fixture:al:al14",
        "fixture:al:al08"
      ],
      "title": "Neon Rain - Single",
      "titleLatin": null,
      "type": "single"
    },
    {
      "artistDisplay": "ヴィオラ・ノート",
      "artistIds": [
        "fixture:ar:ar09"
      ],
      "artworkUrl": "fixtures/art/al13.svg",
      "id": "fixture:al:al13",
      "latinSource": "cutlet",
      "releaseDate": "2021-06-02",
      "similar": [
        "fixture:al:al25",
        "fixture:al:al04",
        "fixture:al:al19",
        "fixture:al:al17",
        "fixture:al:al11",
        "fixture:al:al23",
        "fixture:al:al24",
        "fixture:al:al22",
        "fixture:al:al21",
        "fixture:al:al27"
      ],
      "title": "雨音のソナタ",
      "titleLatin": "Amaoto no sonata",
      "type": "album"
    },
    {
      "artistDisplay": "青井ユウ",
      "artistIds": [
        "fixture:ar:ar07"
      ],
      "artworkUrl": "fixtures/art/al14.svg",
      "id": "fixture:al:al14",
      "latinSource": null,
      "releaseDate": "2026-03-04",
      "similar": [
        "fixture:al:al06",
        "fixture:al:al16",
        "fixture:al:al08",
        "fixture:al:al02",
        "fixture:al:al10",
        "fixture:al:al20",
        "fixture:al:al32",
        "fixture:al:al33",
        "fixture:al:al09",
        "fixture:al:al07"
      ],
      "title": "Blue Diary",
      "titleLatin": null,
      "type": "album"
    },
    {
      "artistDisplay": "ｶﾞﾗｽﾉﾈｺ",
      "artistIds": [
        "fixture:ar:ar05"
      ],
      "artworkUrl": "fixtures/art/al15.svg",
      "id": "fixture:al:al15",
      "latinSource": "cutlet",
      "releaseDate": "2023-11-22",
      "similar": [
        "fixture:al:al06",
        "fixture:al:al10",
        "fixture:al:al04",
        "fixture:al:al20",
        "fixture:al:al02",
        "fixture:al:al05",
        "fixture:al:al22",
        "fixture:al:al17",
        "fixture:al:al13",
        "fixture:al:al29"
      ],
      "title": "猫の目",
      "titleLatin": "Neko no me",
      "type": "album"
    },
    {
      "artistDisplay": "ＬＵＭＩＮＡ",
      "artistIds": [
        "fixture:ar:ar03"
      ],
      "artworkUrl": "fixtures/art/al16.svg",
      "id": "fixture:al:al16",
      "latinSource": null,
      "releaseDate": "2026-01-21",
      "similar": [
        "fixture:al:al18",
        "fixture:al:al02",
        "fixture:al:al14",
        "fixture:al:al32",
        "fixture:al:al08",
        "fixture:al:al09",
        "fixture:al:al10",
        "fixture:al:al20",
        "fixture:al:al33",